"COD","CODINTEGR","TITULO","NIVEL","TITABREV","PADRE","NOTA1","NOTA2","NOTA3","VALORNOTA","REFERENCIA","FECHA_NOTA"
"61165","661165","Wholesale trade services, except on a fee or contract basis, of hardware and hand tools",5,"","6116","","","","","",
"6117","66117","Wholesale trade services, except on a fee or contract basis, of chemical and pharmaceutical products",4,"","611","","","","","",
"61171","661171","Wholesale trade services, except on a fee or contract basis, of basic industrial chemicals and synthetic resins",5,"","6117","","","","","",
"61172","661172","Wholesale trade services, except on a fee or contract basis, of fertilizers and agrochemical products",5,"","6117","","","","","",
"61173","661173","Wholesale trade services, except on a fee or contract basis, of pharmaceutical products",5,"","6117","","","","","",
"61174","661174","Wholesale trade services, except on a fee or contract basis, of medical and orthopaedic goods",5,"","6117","","","","","",
"61175","661175","Wholesale trade services, except on a fee or contract basis, of perfumery articles, cosmetic articles and toilet soaps",5,"","6117","","","","","",
"61176","661176","Wholesale trade services, except on a fee or contract basis, of cleaning materials",5,"","6117","","","","","",
"6118","66118","Wholesale trade services, except on a fee or contract basis, of machinery, equipment and supplies",4,"","611","","","","","",
"61181","661181","Wholesale trade services, except on a fee or contract basis, of motor vehicles, motorcycles, snowmobiles and related parts and accessories",5,"","6118","","","","","",
"61182","661182","Wholesale trade services, except on a fee or contract basis, of other transport equipment, except bicycles",5,"","6118","","","","","",
"61183","661183","Wholesale trade services, except on a fee or contract basis, of office machinery and equipment including office furniture",5,"","6118","","","","","",
"61184","661184","Wholesale trade services, except on a fee or contract basis, of computers and packaged software",5,"","6118","","","","","",
"61185","661185","Wholesale trade services, except on a fee or contract basis, of electronic and telecommunications equipment and parts",5,"","6118","","","","","",
"61186","661186","Wholesale trade services, except on a fee or contract basis, of agricultural lawn and garden machinery and equipment, including tractors",5,"","6118","","","","","",
"61187","661187","Wholesale trade services, except on a fee or contract basis, of mining, construction and civil engineering machinery and equipment",5,"","6118","","","","","",
"483","4483","Optical instruments and photographic equipment, and parts and accessories thereof",3,"","48","","","","","",
"4831","44831","Optical instruments",4,"","483","","","","","",
"48311","448311","Optical fibres and optical fibre bundles; optical fibre cables (except those made up of individually sheathed fibres); sheets and plates of polarizing material; lenses, prisms, mirrors and other optical elements (except of glass not optically worked), whether or not mounted, other than for cameras, projectors or photographic enlargers or reducers",5,"","4831","","","","","",
"48312","448312","Spectacles, goggles and the like, corrective, protective or other",5,"","4831","","","","","",
"48313","448313","Frames and mountings for spectacles, goggles or the like",5,"","4831","","","","","",
"48314","448314","Binoculars, monoculars and other optical telescopes; other astronomical instruments, except instruments for radio-astronomy; compound optical microscopes",5,"","4831","","","","","",
"48315","448315","Liquid crystal devices n.e.c.; lasers, except laser diodes; other optical appliances and instruments n.e.c.",5,"","4831","","","","","",
"4832","44832","Photographic equipment",4,"","483","","","","","",
"48321","448321","Objective lenses for cameras, projectors or photographic enlargers or reducers",5,"","4832","","","","","",
"48322","448322","Photographic (including cinematographic) cameras",5,"","4832","","","","","",
"48323","448323","Cinematographic projectors",5,"","4832","","","","","",
"48329","448329","Other photographic equipment",5,"","4832","","","","","",
"4834","44834","Photographic plates and film and instant print film, sensitized, unexposed; chemical products for photographic uses, except varnishes, adhesives and the like",4,"","483","","","","","",
"48341","448341","Photographic plates and film and instant print film, sensitized, unexposed",5,"","4834","","","","","",
"48342","448342","Chemical preparations for photographic uses, except varnishes, adhesives and the like; unmixed products for photographic uses, put up in measured portions or put up for retail sale in a form ready for use",5,"","4834","","","","","",
"4835","44835","Parts for the goods of classes 4831 to 4833",4,"","483","","","","","",
"48351","448351","Parts and accessories for the goods of subclass 48314",5,"","4835","","","","","",
"48352","448352","Parts of goods of subclass 48313",5,"","4835","","","","","",
"48353","448353","Parts and accessories for the goods of subclass 48322; parts and accessories of cinematographic projectors; parts and accessories of photographic flashlight apparatus; parts and accessories of image projectors (except cinematographic) and photographic (except cinematographic) enlargers and reducers; parts and accessories n.e.c. of apparatus and equipment for photographic laboratories; parts and accessories of negatoscopes and projection screens",5,"","4835","","","","","",
"48354","448354","Parts and accessories for the goods of subclass 48315",5,"","4835","","","","","",
"484","4484","Watches and clocks, and parts thereof",3,"","48","","","","","",
"4841","44841","Watches",4,"","484","","","","","",
"48410","448410","Watches",5,"","4841","","","","","",
"4842","44842","Clocks",4,"","484","","","","","",
"48420","448420","Clocks",5,"","4842","","","","","",
"4843","44843","Time of day recording apparatus, apparatus for measuring, recording or otherwise indicating intervals of time, and time switches, with clock or watch movement or with synchronous motor",4,"","484","","","","","",
"48430","448430","Time of day recording apparatus, apparatus for measuring, recording or otherwise indicating intervals of time, and time switches, with clock or watch movement or with synchronous motor",5,"","4843","","","","","",
"4844","44844","Watch or clock movements",4,"","484","","","","","",
"48440","448440","Watch or clock movements",5,"","4844","","","","","",
"4849","44849","Other watch or clock parts (including jewels, cases and metal watch bands)",4,"","484","","","","","",
"48490","448490","Other watch or clock parts (including jewels, cases and metal watch bands)",5,"","4849","","","","","",
"49","449","Transport equipment",2,"","4","","","","","",
"491","4491","Motor vehicles, trailers and semi-trailers; parts and accessories thereof",3,"","49","","","","","",
"4911","44911","Motor vehicles",4,"","491","","","","","",
"49111","449111","Road tractors for semi-trailers",5,"","4911","","","","","",
"49112","449112","Public-transport type passenger motor vehicles",5,"","4911","","","","","",
"49113","449113","Motor cars and other motor vehicles principally designed for the transport of persons (except public-transport type vehicles, vehicles specially designed for travelling on snow, and golf cars and similar vehicles)",5,"","4911","","","","","",
"49114","449114","Motor vehicles n.e.c. for the transport of goods",5,"","4911","","","","","",
"49115","449115","Crane lorries",5,"","4911","","","","","",
"49116","449116","Motor vehicles, for the transport of persons, specially designed for travelling on snow; golf cars and similar vehicles",5,"","4911","","","","","",
"49119","449119","Special-purpose motor vehicles n.e.c.",5,"","4911","","","","","",
"4912","44912","Parts and accessories n.e.c. of motor vehicles",4,"","491","","","","","",
"49121","449121","Chassis fitted with engines, for motor vehicles",5,"","4912","","","","","",
"49129","449129","Other parts and accessories n.e.c. of motor vehicles (including brakes, gear boxes, axles, road wheels, suspension shock absorbers, radiators, silencers, exhaust pipes, clutches, steering wheels, steering columns, steering boxes, and parts thereof)",5,"","4912","","","","","",
"492","4492","Bodies (coachwork) for motor vehicles; trailers and semi-trailers; parts and accessories thereof",3,"","49","","","","","",
"4921","44921","Bodies for motor vehicles",4,"","492","","","","","",
"49210","449210","Bodies for motor vehicles",5,"","4921","","","","","",
"4922","44922","Trailers and semi-trailers; containers",4,"","492","","","","","",
"49221","449221","Containers specially designed and equipped for carriage by one or more modes of transport",5,"","4922","","","","","",
"49222","449222","Trailers and semi-trailers of the caravan type, for housing or camping",5,"","4922","","","","","",
"49229","449229","Other trailers and semi-trailers (including trailers and semi-trailers for the transport of goods), except self-loading or self-unloading trailers or semi-trailers for agricultural purposes",5,"","4922","","","","","",
"4923","44923","Parts for the goods of classes 4921 and 4922",4,"","492","","","","","",
"49231","449231","Parts and accessories for the goods of subclass 49210",5,"","4923","","","","","",
"49232","449232","Parts of trailers and semi-trailers; parts of other vehicles, not mechanically propelled",5,"","4923","","","","","",
"493","4493","Ships",3,"","49","","","","","",
"4931","44931","Commercial ships and warships",4,"","493","","","","","",
"49311","449311","Cruise ships, excursion boats and similar vessels, principally designed for the transport of persons; ferry boats of all kinds",5,"","4931","","","","","",
"49312","449312","Tankers (ships)",5,"","4931","","","","","",
"49313","449313","Refrigerator vessels (ships), except tankers",5,"","4931","","","","","",
"49314","449314","Other vessels for the transport of goods and other vessels for the transport of both persons and goods",5,"","4931","","","","","",
"49315","449315","Fishing vessels; factory ships and other vessels for processing or preserving fishery products",5,"","4931","","","","","",
"49316","449316","Tugs and pusher craft",5,"","4931","","","","","",
"49319","449319","Other vessels (including light-vessels, fire-floats, dredgers, floating cranes, floating docks, warships and lifeboats other than rowing boats), except floating or submersible drilling or production platforms",5,"","4931","","","","","",
"4932","44932","Floating or submersible drilling or production platforms",4,"","493","","","","","",
"49320","449320","Floating or submersible drilling or production platforms",5,"","4932","","","","","",
"4939","44939","Other floating structures",4,"","493","","","","","",
"49390","449390","Other floating structures",5,"","4939","","","","","",
"494","4494","Pleasure and sporting boats",3,"","49","","","","","",
"4941","44941","Sailboats (except inflatable), with or without auxiliary motor",4,"","494","","","","","",
"49410","449410","Sailboats (except inflatable), with or without auxiliary motor",5,"","4941","","","","","",
"651","6651","Land transport services of freight",3,"","65","","","","","",
"6511","66511","Road transport services of freight",4,"","651","","","","","",
"65111","665111","Road transport services of freight by refrigerator vehicles",5,"","6511","","","","","",
"65112","665112","Road transport services of freight by tank trucks or semi-trailers",5,"","6511","","","","","",
"65113","665113","Road transport services of intermodal containers",5,"","6511","","","","","",
"65114","665114","Road transport services of freight by man- or animal-drawn vehicles",5,"","6511","","","","","",
"65115","665115","Moving services of household furniture and household goods",5,"","6511","","","","","",
"65116","665116","Road transport services of letters and parcels",5,"","6511","","","","","",
"65117","665117","Road transport services of dry bulk",5,"","6511","","","","","",
"65118","665118","Road transport services of live animals",5,"","6511","","","","","",
"65119","665119","Other road transport services of freight",5,"","6511","","","","","",
"6512","66512","Railway transport services of freight",4,"","651","","","","","",
"65121","665121","Railway transport services of freight by refrigerator cars",5,"","6512","","","","","",
"65122","665122","Railway transport services of freight by tanker cars",5,"","6512","","","","","",
"65123","665123","Railway transport services of intermodal containers",5,"","6512","","","","","",
"65124","665124","Railway transport services of letters and parcels",5,"","6512","","","","","",
"65125","665125","Railway transport services of dry bulk goods",5,"","6512","","","","","",
"65126","665126","Railway transport services of live animals",5,"","6512","","","","","",
"65129","665129","Other railway transport services of freight",5,"","6512","","","","","",
"6513","66513","Transport services via pipeline",4,"","651","","","","","",
"65131","665131","Transport services via pipeline of petroleum and natural gas",5,"","6513","","","","","",
"65139","665139","Transport services via pipeline of other goods",5,"","6513","","","","","",
"652","6652","Water transport services of freight",3,"","65","","","","","",
"6521","66521","Coastal and transoceanic water transport services of freight",4,"","652","","","","","",
"65211","665211","Coastal and transoceanic water transport services of freight by refrigerator vessels",5,"","6521","","","","","",
"65212","665212","Coastal and transoceanic water transport services of freight by tankers",5,"","6521","","","","","",
"65213","665213","Coastal and transoceanic water transport services of intermodal containers by container ships",5,"","6521","","","","","",
"65219","665219","Other coastal and transoceanic water transport services of other freight",5,"","6521","","","","","",
"6522","66522","Inland water transport services of freight",4,"","652","","","","","",
"65221","665221","Inland water transport services of freight by refrigerator vessels",5,"","6522","","","","","",
"65222","665222","Inland water transport services of freight by tankers",5,"","6522","","","","","",
"65229","665229","Other inland water transport services of freight",5,"","6522","","","","","",
"653","6653","Air and space transport services of freight",3,"","65","","","","","",
"6531","66531","Air transport services of freight",4,"","653","","","","","",
"65311","665311","Air transport services of letters and parcels",5,"","6531","","","","","",
"65319","665319","Air transport services of other freight",5,"","6531","","","","","",
"6532","66532","Space transport services of freight",4,"","653","","","","","",
"65320","665320","Space transport services of freight",5,"","6532","","","","","",
"66","666","Rental services of transport vehicles with operators",2,"","6","","","","","",
"660","6660","Rental services of transport vehicles with operators",3,"","66","","","","","",
"6601","66601","Rental services of road vehicles with operators",4,"","660","","","","","",
"66011","666011","Rental services of buses and coaches with operator",5,"","6601","","","","","",
"66012","666012","Rental services of trucks with operator",5,"","6601","","","","","",
"6602","66602","Rental services of water vessels with operator",4,"","660","","","","","",
"66021","666021","Rental services of passenger vessels for coastal and transoceanic water transport with operator",5,"","6602","","","","","",
"66022","666022","Rental services of freight vessels for coastal and transoceanic water transport with operator",5,"","6602","","","","","",
"66023","666023","Rental services of passenger vessels for inland water transport with operator",5,"","6602","","","","","",
"66024","666024","Rental services of freight vessels for inland water transport with operator",5,"","6602","","","","","",
"6603","66603","Rental services of aircraft with operator",4,"","660","","","","","",
"66031","666031","Rental services of passenger aircraft with operator",5,"","6603","","","","","",
"66032","666032","Rental services of freight aircraft with operator",5,"","6603","","","","","",
"67","667","Supporting transport services",2,"","6","","","","","",
"671","6671","Cargo handling services",3,"","67","","","","","",
"6711","66711","Container handling services",4,"","671","","","","","",
"67110","667110","Container handling services",5,"","6711","","","","","",
"6719","66719","Other cargo and baggage handling services",4,"","671","","","","","",
"67190","667190","Other cargo and baggage handling services",5,"","6719","","","","","",
"672","6672","Storage and warehousing services",3,"","67","","","","","",
"6721","66721","Refrigerated storage services",4,"","672","","","","","",
"67210","667210","Refrigerated storage services",5,"","6721","","","","","",
"6722","66722","Bulk liquid or gas storage services",4,"","672","","","","","",
"67220","667220","Bulk liquid or gas storage services",5,"","6722","","","","","",
"6729","66729","Other storage and warehousing services",4,"","672","","","","","",
"67290","667290","Other storage and warehousing services",5,"","6729","","","","","",
"673","6673","Supporting services for railway transport",3,"","67","","","","","",
"6731","66731","Railway pushing or towing services",4,"","673","","","","","",
"67310","667310","Railway pushing or towing services",5,"","6731","","","","","",
"6739","66739","Other supporting services for railway transport",4,"","673","","","","","",
"67390","667390","Other supporting services for railway transport",5,"","6739","","","","","",
"674","6674","Supporting services for road transport",3,"","67","","","","","",
"6741","66741","Bus station services",4,"","674","","","","","",
"67410","667410","Bus station services",5,"","6741","","","","","",
"6742","66742","Highway, bridge and tunnel operation services",4,"","674","","","","","",
"67420","667420","Highway, bridge and tunnel operation services",5,"","6742","","","","","",
"6743","66743","Parking lot services",4,"","674","","","","","",
"67430","667430","Parking lot services",5,"","6743","","","","","",
"6744","66744","Towing services for commercial and private vehicles",4,"","674","","","","","",
"67440","667440","Towing services for commercial and private vehicles",5,"","6744","","","","","",
"6749","66749","Other supporting services for road transport",4,"","674","","","","","",
"67490","667490","Other supporting services for road transport",5,"","6749","","","","","",
"675","6675","Supporting services for water transport",3,"","67","","","","","",
"6751","66751","Port and waterway operation services (excl. cargo handling)",4,"","675","","","","","",
"67511","667511","Port and waterway operation services (excl. cargo handling), on coastal and transoceanic waters",5,"","6751","","","","","",
"67512","667512","Inland waterway operation services (excl. cargo handling)",5,"","6751","","","","","",
"6752","66752","Pilotage and berthing services",4,"","675","","","","","",
"67521","667521","Pilotage and berthing services on coastal and transoceanic waters",5,"","6752","","","","","",
"67522","667522","Pilotage and berthing services in inland waters",5,"","6752","","","","","",
"6753","66753","Vessel salvage and refloating services",4,"","675","","","","","",
"67531","667531","Vessel salvage and refloating services on coastal and transoceanic waters",5,"","6753","","","","","",
"67532","667532","Vessel salvage and refloating services in inland waters",5,"","6753","","","","","",
"6759","66759","Other supporting services for water transport",4,"","675","","","","","",
"67590","667590","Other supporting services for water transport",5,"","6759","","","","","",
"676","6676","Supporting services for air or space transport",3,"","67","","","","","",
"6761","66761","Airport operation services (excl. cargo handling)",4,"","676","","","","","",
"67610","667610","Airport operation services (excl. cargo handling)",5,"","6761","","","","","",
"6762","66762","Air traffic control services",4,"","676","","","","","",
"67620","667620","Air traffic control services",5,"","6762","","","","","",
"6763","66763","Other supporting services for air transport",4,"","676","","","","","",
"67630","667630","Other supporting services for air transport",5,"","6763","","","","","",
"6764","66764","Supporting services for space transport",4,"","676","","","","","",
"67640","667640","Supporting services for space transport",5,"","6764","","","","","",
"679","6679","Other supporting transport services",3,"","67","","","","","",
"6791","66791","Freight transport agency services and other freight transport services",4,"","679","","","","","",
"67910","667910","Freight transport agency services and other freight transport services",5,"","6791","","","","","",
"6799","66799","Other supporting transport services n.e.c.",4,"","679","","","","","",
"67990","667990","Other supporting transport services n.e.c.",5,"","6799","","","","","",
"68","668","Postal and courier services",2,"","6","","","","","",
"680","6680","Postal and courier services",3,"","68","","","","","",
"6801","66801","Postal services",4,"","680","","","","","",
"68011","668011","Postal services related to letters",5,"","6801","","","","","",
"68012","668012","Postal services related to parcels",5,"","6801","","","","","",
"68013","668013","Post office counter services",5,"","6801","","","","","",
"68019","668019","Other postal services",5,"","6801","","","","","",
"6802","66802","Courier services",4,"","680","","","","","",
"68021","668021","Domestic courier services",5,"","6802","","","","","",
"68022","668022","International courier services",5,"","6802","","","","","",
"6803","66803","Local delivery services",4,"","680","","","","","",
"68030","668030","Local delivery services",5,"","6803","","","","","",
"69","669","Electricity, gas and water distribution (on own account)",2,"","6","","","","","",
"691","6691","Electricity and gas distribution (on own account)",3,"","69","","","","","",
"6911","66911","Electricity transmission and distribution (on own account)",4,"","691","","","","","",
"69111","669111","Transmission of electricity (on own account)",5,"","6911","","","","","",
"69112","669112","Distribution of electricity (on own account)",5,"","6911","","","","","",
"6912","66912","Gas distribution through mains (on own account)",4,"","691","","","","","",
"69120","669120","Gas distribution through mains (on own account)",5,"","6912","","","","","",
"692","6692","Water distribution (on own account)",3,"","69","","","","","",
"6921","66921","Water distribution through mains, except steam and hot water (on own account)",4,"","692","","","","","",
"69210","669210","Water distribution through mains, except steam and hot water (on own account)",5,"","6921","","","","","",
"6922","66922","Distribution of steam, hot water and air-conditioning supply through mains (on own account)",4,"","692","","","","","",
"69220","669220","Distribution of steam, hot water and air-conditioning supply through mains (on own account)",5,"","6922","","","","","",
"6923","66923","Water distribution, except through mains (on own account)",4,"","692","","","","","",
"69230","669230","Water distribution, except through mains (on own account)",5,"","6923","","","","","",
"7","7","Financial and related services; real estate services; and rental and leasing services",1,"","","","","","","",
"71","771","Financial and related services",2,"","7","","","","","",
"711","7711","Financial services, except investment banking, insurance services and pension services",3,"","71","","","","","",
"7111","77111","Central banking services",4,"","711","","","","","",
"71110","771110","Central banking services",5,"","7111","","","","","",
"7112","77112","Deposit services",4,"","711","","","","","",
"71121","771121","Deposit services to corporate and institutional depositors",5,"","7112","","","","","",
"71122","771122","Deposit services to other depositors",5,"","7112","","","","","",
"7113","77113","Credit-granting services",4,"","711","","","","","",
"71131","771131","Residential mortgage loan services",5,"","7113","","","","","",
"71132","771132","Non-residential mortgage loan services",5,"","7113","","","","","",
"71133","771133","Personal non-mortgage loan services for non-business purposes",5,"","7113","","","","","",
"71134","771134","Credit card loan services",5,"","7113","","","","","",
"71135","771135","Non-mortgage loan services for business purposes",5,"","7113","","","","","",
"71139","771139","Other credit-granting services",5,"","7113","","","","","",
"7114","77114","Financial leasing services",4,"","711","","","","","",
"71140","771140","Financial leasing services",5,"","7114","","","","","",
"7119","77119","Other financial services, except investment banking, insurance services and pension services",4,"","711","","","","","",
"71190","771190","Other financial services, except investment banking, insurance services and pension services",5,"","7119","","","","","",
"712","7712","Investment banking services",3,"","71","","","","","",
"7120","77120","Investment banking services",4,"","712","","","","","",
"71200","771200","Investment banking services",5,"","7120","","","","","",
"713","7713","Insurance and pension services (excluding reinsurance services), except compulsory social security services",3,"","71","","","","","",
"7131","77131","Life insurance and pension services (excluding reinsurance services)",4,"","713","","","","","",
"71311","771311","Life insurance services",5,"","7131","","","","","",
"71312","771312","Individual pension services",5,"","7131","","","","","",
"71313","771313","Group pension services",5,"","7131","","","","","",
"7132","77132","Accident and health insurance services",4,"","713","","","","","",
"71321","771321","Accidental death and dismemberment insurance services",5,"","7132","","","","","",
